sumber,tanggal,username,teks_bersih,kategori_isu,urgensi,sentimen,lokasi_insiden
twitter,2026-03-26,@xquitavee,"Jalan rusak di desa Kuwiran Kecamatan Banyudono Kabupaten Boyolali, menghambat hilirisasi di sektor peternakan Apr 1",Infrastruktur & Jalan,Belum Dilabeli,Belum Dilabeli,Tidak diketahui
twitter,2026-03-26,@Poros_Kuansing,Gebrakan Bupati Suhardiman! Sawit Dipungut Rp20/Kg dengan Target Rp240 Miliar—PKS Wajib Setor untuk Perbaiki Jalan Rusak ! Apr 1,Infrastruktur & Jalan,Belum Dilabeli,Belum Dilabeli,Tidak diketahui
twitter,2026-03-26,@mono_khrom,"ini kacamata keknya beneran nyatu ke kepala.. sering banget ga nyadar make atw kaga, terutama di kamar lampu mati , blur / kaga gabisa dibedain.. jdnya kudu deketin tangan ke mata buat ngecek, ""lagi kacamataan ga ni"" Apr 1",Infrastruktur & Jalan,Belum Dilabeli,Belum Dilabeli,Tidak diketahui
twitter,2026-03-26,@zevasptri,Untung skrg aku dah nyaman tidur kalau lampu mati . Tinggal cari pasangannya aja Apr 1,Infrastruktur & Jalan,Belum Dilabeli,Belum Dilabeli,Tidak diketahui
twitter,2026-03-26,@tanyarlfes,ak lampu mati atau nyala bisa tidur kok kak Apr 1,Infrastruktur & Jalan,Belum Dilabeli,Belum Dilabeli,Tidak diketahui
twitter,2026-03-26,@daengbang06,"Akuh orang mamuju. Dari kota kecamatan menuju Desa Kopeang HARUS MOBIL 4x4, kalok truk yg 6 ato 10 ban bannya di lilit2 make rante besi agar bisa nanjak. Tanjakan tinggi, jalan rusak dan berlumpur Apr 1",Infrastruktur & Jalan,Belum Dilabeli,Belum Dilabeli,Tidak diketahui
twitter,2026-03-26,@4SHOrui,kk lui boboknya nutup mata terus apa dy tim lampu mati iya?? Apr 1,Infrastruktur & Jalan,Belum Dilabeli,Belum Dilabeli,Tidak diketahui
twitter,2026-03-26,@CPtanyarl,"Kalah tuh kalau berhenti berusaha. Kalau masih mikirin ini, berarti belum kalah, kok. Idealisme itu kayak kompas: dia kasih tahu arah utara jalan lurus, penuh prinsip, sesuai nilai yang lu yakini. Tapi realitas itu medannya. Kadang ada jurang, tembok, atau jalan rusak yang - Apr 1",Infrastruktur & Jalan,Belum Dilabeli,Belum Dilabeli,Tidak diketahui
twitter,2026-03-26,@AlvianB48,Lampu mati 2.2K = End Live Apr 1,Infrastruktur & Jalan,Belum Dilabeli,Belum Dilabeli,Tidak diketahui
twitter,2026-03-26,@vanstrocytes,APA CB TBTB LAMPU MATI WKWKKWW Apr 1,Infrastruktur & Jalan,Belum Dilabeli,Belum Dilabeli,Tidak diketahui
twitter,2026-03-26,@mellymillo23,Gila ada seorang ibu di Mamuju terpaksa harus melahirkan di tengah jalan karena terhalang jalan rusak . Bayangin seburuk apa korupsi yang mereka lakukan sehingga rakyatnya gak bisa dapet akses jalan yang baik ?! Buat apa apbn kalo gak dibuat perbaikan jalan ?? Miris Mar 31,Infrastruktur & Jalan,Belum Dilabeli,Belum Dilabeli,Tidak diketahui
twitter,2026-03-26,@beulangong174,"FEATURE | Menantang Maut di Tali Jembatan Putus Beutong Ateuh, Mar 31",Infrastruktur & Jalan,Belum Dilabeli,Belum Dilabeli,Tidak diketahui
twitter,2026-03-26,@mildamiee,"IH SAMA, saking sukanya baca jd ampe org tidur, lampu mati masih tetep lanjut Mar 31",Infrastruktur & Jalan,Belum Dilabeli,Belum Dilabeli,Tidak diketahui
twitter,2026-03-26,@yassinasco,"Manfaat tidur lampu mati : - Produksi melatonin optimal → tidur nyenyak, cepat pulih. - Ritme sirkadian sehat, kurangi risiko obesitas, diabetes, hipertensi. - Kurangi stres & depresi. - Kesehatan metabolik & jantung lebih baik. Studi UCLA & NIH dukung ini. Matikan lampu malam Mar 31",Infrastruktur & Jalan,Belum Dilabeli,Belum Dilabeli,Tidak diketahui
twitter,2026-03-26,@nugusiyu,abis mandi pake scrub & lotion.... wangi maksimal.... hujan.... dingin.... selimutan.... lampu mati .... pake diffuser lavender di kamar.... nikmat bgt makasih yaallah.... Mar 31,Infrastruktur & Jalan,Belum Dilabeli,Belum Dilabeli,Tidak diketahui
twitter,2026-03-26,@banten_pemprov,"ANJING INFRASTRUKTUR MASIH BANYAK YANG RUSAK, ANJING. ADA ORANG YG MATI GARA2 JALAN RUSAK Mar 31",Infrastruktur & Jalan,Belum Dilabeli,Belum Dilabeli,Tidak diketahui
twitter,2026-03-26,@agsha_rijuan,"ditengah proses kita mencari jati diri dan tujuan hidup, selalu dan akan selalu dapet jalan rusak bahkan bergelombang Mar 31",Infrastruktur & Jalan,Belum Dilabeli,Belum Dilabeli,Tidak diketahui
twitter,2026-03-26,@JohnBanting03,Jalan rusak kmaren udah dibenerin blm beb... Mar 31,Infrastruktur & Jalan,Belum Dilabeli,Belum Dilabeli,Tidak diketahui
twitter,2026-03-26,@mkini_bm,"Ketawa kerana jalan berlubang dan rosak, jalan tiada ruangan basikal dan tempat kerja tiada bilik mandi. Mar 31",Infrastruktur & Jalan,Belum Dilabeli,Belum Dilabeli,Tidak diketahui
twitter,2026-03-26,@nusabalicom,"Warga Banjar Tatag, Desa Taro, Kecamatan Tegallalang, menambal jalan berlubang secara gotong royong secara swadaya. Inisiatif warga ini lantaran khawatir terhadap keselamatan pengguna jalan. Mar 31",Infrastruktur & Jalan,Belum Dilabeli,Belum Dilabeli,Tidak diketahui
twitter,2026-03-26,@basebuku,"Last Days dan The Graveyard Apartment, dua buku ini dijamin merinding ga bisa tidur dgn lampu mati Mar 31",Infrastruktur & Jalan,Belum Dilabeli,Belum Dilabeli,Tidak diketahui
twitter,2026-03-26,@WagimanDeep212_,Jalan rusak didiemin si paling Marwah ni Mar 31,Infrastruktur & Jalan,Belum Dilabeli,Belum Dilabeli,Tidak diketahui
twitter,2026-03-26,@kuterculik,"Currently, the Nglebak Village community is independently building a 1.5-kilometre district road, and the results will be reported to all donors. Mar 31",Infrastruktur & Jalan,Belum Dilabeli,Belum Dilabeli,Tidak diketahui
twitter,2026-03-26,@polres_belu,"Personel Polsek Raimanuk, Polres Belu sigap memasang police line di lokasi jalan berlubang akibat longsor sebagai langkah antisipasi demi keselamatan pengguna jalan. Mar 31",Infrastruktur & Jalan,Belum Dilabeli,Belum Dilabeli,Tidak diketahui
twitter,2026-03-26,@seblaksiput,"Kenapa banyak bgt cobaan di rumah tiap laki gw lagi berlayar ya keran bocor, selang copot, lampu mati Mar 31",Infrastruktur & Jalan,Belum Dilabeli,Belum Dilabeli,Tidak diketahui
twitter,2026-03-26,@bharianmy,"Asyik nak tuding jari kat orang ajer. Jenis bingai dan dongoi mmg x boleh bawa bincang. Woi dongoi punya menteri, kalau jalan berlubang sebelum krajaan Madani, pak menteri bingai ni nak salahkan kerajaan dulu juga ka. Cap Ayam Mar 31",Infrastruktur & Jalan,Belum Dilabeli,Belum Dilabeli,Tidak diketahui
twitter,2026-03-26,@LambeSahamjja,Yang di pulau jawa aja masih banyak jalan rusak min di daerah2. Bahkan banyak yg kecelakaan motor karna Mar 31,Infrastruktur & Jalan,Belum Dilabeli,Belum Dilabeli,Tidak diketahui
twitter,2026-03-26,@FraksiPKB,"“ Jalan rusak bukan hanya persoalan infrastruktur, tetapi bisa menjadi penentu antara keselamatan dan kehilangan nyawa. Ketika akses menuju layanan kesehatan terhambat, masyarakat berada dalam risiko besar,” ujar perempuan yang akrab disapa Ninik Mar 31",Infrastruktur & Jalan,Belum Dilabeli,Belum Dilabeli,Tidak diketahui
twitter,2026-03-26,@FraksiPKB,"Wakil Ketua Komisi IX DPR RI, Nihayatul Wafiroh, menegaskan bahwa persoalan jalan rusak tidak bisa dipandang semata sebagai isu infrastruktur, melainkan menyangkut keselamatan jiwa. Mar 31",Infrastruktur & Jalan,Belum Dilabeli,Belum Dilabeli,Tidak diketahui
twitter,2026-03-26,@pln_123,Tagihan dibayar gak boleh telat tp lampu mati berjam2 asik disuruh nunggu astagaaaaa klo gak ada anak kecil gue gak akan berisik Ini anak gue nangis2 dua2 nya apagak makin mau pecah kepala Apalagi dibekasi itu listrik mati ya air mati jg Mar 31,Infrastruktur & Jalan,Belum Dilabeli,Belum Dilabeli,Tidak diketahui
twitter,2026-03-26,@kuterculik,"According to data from the Tangerang Police, over the last two weeks, four fatal accidents have occurred in the Pasar Kemis area. Mar 31",Infrastruktur & Jalan,Belum Dilabeli,Belum Dilabeli,Tidak diketahui
twitter,2026-03-26,@darkside_gurl,"intinya tiap nabrak jalan berlubang , yang gua tololin pertama kali adalah pemerintah Mar 31",Infrastruktur & Jalan,Belum Dilabeli,Belum Dilabeli,Tidak diketahui
twitter,2026-03-26,@valleeriz,Lampu mati Mar 31,Infrastruktur & Jalan,Belum Dilabeli,Belum Dilabeli,Tidak diketahui
twitter,2026-03-26,@Pado_Sutan,"Kampung Maling, Rampok, Penadah PATI minta keadilan atas jalan rusak , pemerintah di JAWA pasti melindungi para maling itu Mar 31",Infrastruktur & Jalan,Belum Dilabeli,Belum Dilabeli,Tidak diketahui
twitter,2026-03-26,@silmarillion_22,"mati lampu + mati air, udahlah tidur aja sampe dikabarin nyala Mar 31",Infrastruktur & Jalan,Belum Dilabeli,Belum Dilabeli,Tidak diketahui
twitter,2026-03-26,@criesofbtterfly,"sampe SMP ku msh suka ngebolang, pas SD inget banget pernah main di kubangan air (yang jalan rusak gitu lho, kubangannya gede and agak dalem waktu itu, jadi klo anak SD bisa berendam2 gitu) deket sekolah sampe dimarahin ama antar jemputku, krn kita se anjem basah semua wkkwkwkwk Mar 31",Infrastruktur & Jalan,Belum Dilabeli,Belum Dilabeli,Tidak diketahui
twitter,2026-03-26,@jessjjey,"Langganan bgt sakit punggung sampe leher hampir tiap PMS. Sakitnya tu sakiiittt bgt Kalau tete, membengkak & memadat. Ngilu kalo berkendara & lewatin polisi tidur atau jalan berlubang² Mar 31",Infrastruktur & Jalan,Belum Dilabeli,Belum Dilabeli,Tidak diketahui
twitter,2026-03-26,@Kintakun_ID,"kamu tim lampu nyala or tim lampu mati pas bobo? menurut keyakinan saya lebih baik kalo bobo lampunya jangan terlalu terang fix ini ngaruh.. kalo lampu masih terang banget, badan tuh kayak belum diajak istirahat. coba lampu yang lebih warm, biar vibesnya makin relax Mar 31",Infrastruktur & Jalan,Belum Dilabeli,Belum Dilabeli,Tidak diketahui
twitter,2026-03-26,@miolistrik,"kalo betul2 mikirin prioritas, masih ada banyak banget sekolah reyot, jembatan putus , Mar 31",Infrastruktur & Jalan,Belum Dilabeli,Belum Dilabeli,Tidak diketahui
twitter,2026-03-26,@groobaag,"Jalan rusak bukan takdir, tapi hasil dari ‘nanti dulu’. Kapan dapat perhatian? Mar 31",Infrastruktur & Jalan,Belum Dilabeli,Belum Dilabeli,Tidak diketahui
twitter,2026-03-26,@Vndp__,Jalan berlubang ......bukan lubang berjalan Mar 31,Infrastruktur & Jalan,Belum Dilabeli,Belum Dilabeli,Tidak diketahui
twitter,2026-03-26,@gilaaaangssss,"Kalau perjalanan malam naik bus. Kursinya lbh enak, dapet makan, lampu mati jadi bisa tidur. Kecuali dikejar waktu, bus tetep jadi pilihan utama. Mar 31",Infrastruktur & Jalan,Belum Dilabeli,Belum Dilabeli,Tidak diketahui
twitter,2026-03-26,@txtdarigenz97,"Seorang Ibu Terpaksa Melahirkan di Pinggir Jalan Akibat 5.8K Jalan Rusak . Berdasarkan informasi, kondisi itu terjadi karna sulitnya kendaraan melintas akibat Jalan yang jelek Proses persalinan terpaksa harus dilakukan sebelum ibu itu mencapai fasilitas kesehatan. Kejadian ini Mar 31",Infrastruktur & Jalan,Belum Dilabeli,Belum Dilabeli,Tidak diketahui
twitter,2026-03-26,@arulfatih24,"Jangan kan Mulyono yg presiden dgn bejibun borok... Sekelas lurah di desa aja kalo udh di akhir masa jabatannya.. Yg di pikirin cuma nimbun kekayaan buat masa pensiun.. Rakyat susah, π , dll. Mana perduli.. Malah yg ada sibuk mikirin siapa penerus dia selanjutnya. Mar 31",Infrastruktur & Jalan,Belum Dilabeli,Belum Dilabeli,Tidak diketahui
twitter,2026-03-26,@asriyahcantik,Jalan rusak maka becek mulu Mar 31,Infrastruktur & Jalan,Belum Dilabeli,Belum Dilabeli,Tidak diketahui
twitter,2026-03-26,@Menjjulang,"Dua hal itu valid Kaki keras terutama jalan rusak , kekedapan kurang pas hujan tp kok saya ngerasa malah berisiknya dari kaca depan, road noise bisa diatasi ganti ban tp menurut saya ga terlalu berisik juga Yg bikin menang banget tentu adaptive cruise control, irit dan tenaga ok Mar 31",Infrastruktur & Jalan,Belum Dilabeli,Belum Dilabeli,Tidak diketahui
twitter,2026-03-26,@reyhan_abdi,"ini total PPH21 yang harus gw bayar bulan ini, gede parah. yang lebih menyakitkan, pajak gw dikorup dan gw ga dapat timbal balik. jalan rusak , pendidikan jelek, kesehatan jelek. Mar 31",Infrastruktur & Jalan,Belum Dilabeli,Belum Dilabeli,Tidak diketahui
twitter,2026-03-26,@Xbacottetangga,Ahh mana busa lewat jalan berlubang Mar 31,Infrastruktur & Jalan,Belum Dilabeli,Belum Dilabeli,Tidak diketahui
twitter,2026-03-26,@nihaaa_yah,"Ora ngerti mati murupe. Gur krungu mertuo mbengok, lampu mati kr wis murup. Mar 31",Infrastruktur & Jalan,Belum Dilabeli,Belum Dilabeli,Tidak diketahui
twitter,2026-03-26,@pecintahayam,"penerangan kurang, jalan rusak , pungli, tanpa walikota Mar 31",Infrastruktur & Jalan,Belum Dilabeli,Belum Dilabeli,Tidak diketahui
twitter,2026-03-26,@justforVan_ka,"Aku pernah ngobrol sama ayang perkara | DM cek pinned post Semarang vs Magelang (our hometown), trs dia bilang, ""di Magelang gaada Mar 31",Infrastruktur & Jalan,Belum Dilabeli,Belum Dilabeli,Tidak diketahui
twitter,2026-03-26,@Martogog23,v7FQ?si=ytyIr-Q7G87bxgVd … Mar 31,Infrastruktur & Jalan,Belum Dilabeli,Belum Dilabeli,Tidak diketahui
twitter,2026-03-26,@shdtyaa,gbs tidur krn lampu mati arghh Mar 31,Infrastruktur & Jalan,Belum Dilabeli,Belum Dilabeli,Tidak diketahui
twitter,2026-03-26,@dosenkesmas,Ya kalo kamar mandi kontrakan gw sih bukannya rileks malah tegang yg ada Klo ada kucing lewat kan tegang duluan yak Pernah sekali boker pas lampu mati Mar 31,Infrastruktur & Jalan,Belum Dilabeli,Belum Dilabeli,Tidak diketahui
twitter,2026-03-26,@berhomonim,"Orang-orang di negara lain bisa hidup dengan kualitas sepremium ini. Aku setiap hari hidup cuma bisa lihat jalan rusak , trotoar hancur, lampu jalan pecah. Memang ya negaramu adalah nasib yang gak bisa kamu sangkal. Mar 31",Infrastruktur & Jalan,Belum Dilabeli,Belum Dilabeli,Tidak diketahui
twitter,2026-03-26,@kangm1in,"Boro-boro mau rileks, sepersekian detik lampu mati napas pun langsung sesak. Bukan takut ada sesuatu di pojok kamar mandi tapi kayak oksigen tiba-tiba sekarat. Mar 31",Infrastruktur & Jalan,Belum Dilabeli,Belum Dilabeli,Tidak diketahui
twitter,2026-03-26,@shuorai,"Prefer lampu mati , nyaman buat mata. Mar 31",Infrastruktur & Jalan,Belum Dilabeli,Belum Dilabeli,Tidak diketahui
twitter,2026-03-26,@insidefolkative,"Jalanan kota banyak lubang galian kabel optik kacau ga pernah bener tuhh kerjaannya ,banyak yang celaka gara² jalan berlubang ,,pejabat tutup mata ,yang penting uang masuk ,, Mar 31",Infrastruktur & Jalan,Belum Dilabeli,Belum Dilabeli,Tidak diketahui
twitter,2026-03-26,@em_er_zet,loh gaktau aja kalo malem2 pas 61K lampu mati semua gimana Mar 31,Infrastruktur & Jalan,Belum Dilabeli,Belum Dilabeli,Tidak diketahui
twitter,2026-03-26,@Ribka_JKT48,"setuju tim lampu mati , met bobo ribii Mar 31",Infrastruktur & Jalan,Belum Dilabeli,Belum Dilabeli,Tidak diketahui
twitter,2026-03-26,@evanndeer,keinget pas fate+ unexpected banget gue nangis di still monster 11K lampu mati Mar 31,Infrastruktur & Jalan,Belum Dilabeli,Belum Dilabeli,Tidak diketahui
twitter,2026-03-26,@Ribka_JKT48,yoi sama tim lampu mati Mar 31,Infrastruktur & Jalan,Belum Dilabeli,Belum Dilabeli,Tidak diketahui
twitter,2026-03-26,@javascornercoid,"Jalan Rusak Sintang Viral, Bupati: Sudah Diusulkan Perbaikan - baca selengkapnya: … Mar 31",Infrastruktur & Jalan,Belum Dilabeli,Belum Dilabeli,Tidak diketahui
twitter,2026-03-26,@hrjnys,"Sebetulnya, kontur jalan seperti ini tentu bukan hal yang sulit bagi Yasa. Ia justru jauh lebih akrab dengan medan 𝘰𝘧𝘧-𝘳𝘰𝘢𝘥 yang berkali-kali lebih kasar daripada sekadar jalan berlubang. Hanya saja, di jalan seperti ini ia harus jauh lebih berhati-hati ... Mar 30",Infrastruktur & Jalan,Belum Dilabeli,Belum Dilabeli,Tidak diketahui
twitter,2026-03-26,@yopetals,"Batreku habis, lampu mati mending apa mending tidur Mar 30",Infrastruktur & Jalan,Belum Dilabeli,Belum Dilabeli,Tidak diketahui
twitter,2026-03-26,@Ribka_JKT48,Tim la mp u mati Mar 30,Infrastruktur & Jalan,Belum Dilabeli,Belum Dilabeli,Tidak diketahui
twitter,2026-03-26,@whosthatrene,yeay aku udah berani tidur dengan lampu mati :D Mar 30,Infrastruktur & Jalan,Belum Dilabeli,Belum Dilabeli,Tidak diketahui
twitter,2026-03-26,@Ribka_JKT48,"Tergantung, klo uda ngantuk berat bisa aja..tp klo blm, ya ga bisa juga, harus banget lampu mati Mar 30",Infrastruktur & Jalan,Belum Dilabeli,Belum Dilabeli,Tidak diketahui
twitter,2026-03-26,@CErine_JKT48,takutan kmu mh pdhl tdr dlm keadaan lampu mati enak tau lebih nyaman tp gapapa semua butuh proses Mar 30,Infrastruktur & Jalan,Belum Dilabeli,Belum Dilabeli,Tidak diketahui
twitter,2026-03-26,@Ribka_JKT48,Team selalu lampu mati kalau tidur Mar 30,Infrastruktur & Jalan,Belum Dilabeli,Belum Dilabeli,Tidak diketahui
twitter,2026-03-26,@terapisz,hrs bgt nih lampu mati skrg??? Mar 30,Infrastruktur & Jalan,Belum Dilabeli,Belum Dilabeli,Tidak diketahui
twitter,2026-03-26,@adnilavon_,"iya juga setiap lewat jalan rusak kerasa bgt guncangannya, klo ganti ban belakang, aki, shockbreaker buset mesti nyampe 1jti agaknya, huaa tp sayang bgt aku sm motor tempur ini, masih tetep aweeet puji tuhan, tolong baik"" terus yah sampe soon bisa service rutin semuanya Mar 30",Infrastruktur & Jalan,Belum Dilabeli,Belum Dilabeli,Tidak diketahui
twitter,2026-03-26,@muzidanapr_,mati listrik hujan jalan berlubang gabawa jas ujan Mar 30,Infrastruktur & Jalan,Belum Dilabeli,Belum Dilabeli,Tidak diketahui
twitter,2026-03-26,@Ribka_JKT48,Iya kan? Mending lampu mati Mar 30,Infrastruktur & Jalan,Belum Dilabeli,Belum Dilabeli,Tidak diketahui
twitter,2026-03-26,@Ribka_JKT48,Aku tim lampu mati rib Mar 30,Infrastruktur & Jalan,Belum Dilabeli,Belum Dilabeli,Tidak diketahui
twitter,2026-03-26,@sinepilgadungan,toji itu yg biasa ngarahin motor mobil lewat di jalur padat sambil bawa toples tulisannya buat pembangunan jalan rusak (pdhl enggak) Mar 30,Infrastruktur & Jalan,Belum Dilabeli,Belum Dilabeli,Tidak diketahui
twitter,2026-03-26,@Ribka_JKT48,Justru tidur lampu mati tuh itu yang anehhhh Mar 30,Infrastruktur & Jalan,Belum Dilabeli,Belum Dilabeli,Tidak diketahui
twitter,2026-03-26,@Gendoet3G,Lagi seru malah lampu mati Bahlil mana bahliiiiilllllllll ??? Mar 30,Infrastruktur & Jalan,Belum Dilabeli,Belum Dilabeli,Tidak diketahui
twitter,2026-03-26,@Ribka_JKT48,Mau 1.3K lampu mati atau nyala juga bisa aku mah Mar 30,Infrastruktur & Jalan,Belum Dilabeli,Belum Dilabeli,Tidak diketahui
twitter,2026-03-26,@Ribka_JKT48,"gatau, aku tim tidur lampu mati garis keras Mar 30",Infrastruktur & Jalan,Belum Dilabeli,Belum Dilabeli,Tidak diketahui
twitter,2026-03-26,@aisukohimiruku,"mana di atas kamar mandi ada jendela ventilasi wakakak klo lampu mati cahaya cuma dari situ, tiba tiba bakekok nampak jelas amit amit awkwokwowk Mar 30",Infrastruktur & Jalan,Belum Dilabeli,Belum Dilabeli,Tidak diketahui
twitter,2026-03-26,@deirxelle,Woilah ngakak bet baca grup . Beneran ga kebayang kalo di negara ini jadi pake kompor listrik dan apa2 jadi serba listrik soalnya lampu mati Mar 30,Infrastruktur & Jalan,Belum Dilabeli,Belum Dilabeli,Tidak diketahui
twitter,2026-03-26,@BagusDLiran,"Apasih susahnya pejabat minimal aspal jalan rusak , lampu jalan ganti yang mati, uangnya bukan uang pribadi, proyek ente yang nentuin, rekanan apalagi. Toh juga kalau jalan mulus, lampu terang, banyak wisatawan juga PAD mu yang meningkat. Mar 30",Infrastruktur & Jalan,Belum Dilabeli,Belum Dilabeli,Tidak diketahui
twitter,2026-03-26,@WatchPms,Ini bisng kerok nya Biang kemacetan nya tepat didepan alfa mart atau depan kebayoran Park mall jalan rusak berlubang prmbatas jalan barrier diletakkan tepat ditengah jalan!! Lalin terbelah dan melambat!! Mar 30,Infrastruktur & Jalan,Belum Dilabeli,Belum Dilabeli,Tidak diketahui
twitter,2026-03-26,@shuorai,"Hi, boleh tolong jawab pertanyaan ku nggak? Mau survey... Kalian team yang lampu mati atau nyala kalau tidur? Mar 30",Infrastruktur & Jalan,Belum Dilabeli,Belum Dilabeli,Tidak diketahui
twitter,2026-03-26,@Darderdor180156,"mampu, tapi belum waktunya mengingat tingkat kemiskinan yang tinggi, pemerintah yang kurang kompeten, dan jalan berlubang juga yang masih pake aspal tipis.. Mar 30",Infrastruktur & Jalan,Belum Dilabeli,Belum Dilabeli,Tidak diketahui
twitter,2026-03-26,@dosenkesmas,"jd inget dulu jaman smp lampu mati , pagi2 mandi aja gelap2, pulang2 nyokap cerita di bak mandinya ada tikus Mar 30",Infrastruktur & Jalan,Belum Dilabeli,Belum Dilabeli,Tidak diketahui
twitter,2026-03-26,@sunnyasyaa,"di depanku udh jatoh grgr jalan berlubang agak dalem dan kondisi jalan yg minim pencahayaan, aku dibelakangnya beneran semepet itu beneran kaget dan panik. refleks teriak dan rem mendadak terus banting motor ke arah kiri, aku udah mikir bakal ditabrak kenceng sama belakang aku Mar 30",Infrastruktur & Jalan,Belum Dilabeli,Belum Dilabeli,Tidak diketahui
twitter,2026-03-26,@dosenkesmas,mana ada 2.6K lampu mati saat mandi yang ada malah panik bjir udh gitu takut dibokongin setan ekwk Mar 30,Infrastruktur & Jalan,Belum Dilabeli,Belum Dilabeli,Tidak diketahui
twitter,2026-03-26,@sunnyasyaa,KONTOL LU SEMUA PEMERINTAH YANG KORUPSI DANA PEMELIHARAAN JALAN. demi Allah aku hampir meninggal di jalan grgr jalan berlubang itu anjinggggg Mar 30,Infrastruktur & Jalan,Belum Dilabeli,Belum Dilabeli,Tidak diketahui
twitter,2026-03-26,@theycallmesap,"terus yaudahlah kan beberapa menit berlalu, sambil ngomongin yg lain juga sama temen gw. tiba saatnya si fore ini mesti closingan, lampu mati , meja sama bangku diberesin.. ada satu karyawan cowo fore lagi beres2 di area luar yg gw nongkrong itu… Mar 30",Infrastruktur & Jalan,Belum Dilabeli,Belum Dilabeli,Tidak diketahui
twitter,2026-03-26,@dosenkesmas,"Dulu waktu kecil karena belum mandi sore tapi udah keduluan 16K lampu mati sampai malam, ya terpaksa bawa satu lilin ke kamar mandi. Itu rasanya mungkin setara dengan mandi di villa ubud, suasananya tenang bikin rileks, mandi air dingin tapi rasanya kayak air hangat Mar 30",Infrastruktur & Jalan,Belum Dilabeli,Belum Dilabeli,Tidak diketahui
twitter,2026-03-26,@laIapankol,"pantesan kalau tidur lampu mati tu langsung lelap, beda kalau nyala rasanya agaa gelisah Mar 30",Infrastruktur & Jalan,Belum Dilabeli,Belum Dilabeli,Tidak diketahui
twitter,2026-03-26,@Xbacottetangga,"kalau masih terjadi seperti ini, jalan rusak bertahun2 tidak diperbaiki karena mungkin daerahnya tidak ada potensi penghasilan buat daerah, maka masih belum bisa dikatakan Pembangunan yang berkeadilan. Mar 30",Infrastruktur & Jalan,Belum Dilabeli,Belum Dilabeli,Tidak diketahui
twitter,2026-03-26,@hdpowersteering,Setir mobil Anda bunyi ‘gluduk’ tiap jalan rusak ? Jangan anggap sepele boskuh! Ini dia penyebabnya: rack end atau long tie rod oblak. Mar 30,Infrastruktur & Jalan,Belum Dilabeli,Belum Dilabeli,Tidak diketahui
twitter,2026-03-26,@Xbacottetangga,Ada jurang juga diterjang Lewat jalan berlubang auto nyungsep Mar 30,Infrastruktur & Jalan,Belum Dilabeli,Belum Dilabeli,Tidak diketahui
twitter,2026-03-26,@salsasaliyem,"80 tahun merdeka, tapi masih ada warga yang harus lahiran di hutan gara-gara jalan rusak . Ironisnya, daerah sebelahnya justru penghasil aspal kelas dunia. Kok bisa ya, aspalnya ada tapi jalannya tetep amburadul… Kesejahteraan masyarakat Kopeang, Peduli Mar 30",Infrastruktur & Jalan,Belum Dilabeli,Belum Dilabeli,Tidak diketahui
twitter,2026-03-26,@Umarhidayah17,"80 tahun merdeka, tapi masih ada warga yang harus lahiran di hutan gara-gara jalan rusak . Ironisnya, daerah sebelahnya justru penghasil aspal kelas dunia. Kok bisa ya, aspalnya ada tapi jalannya tetep amburadul… Kesejahteraan masyarakat Kopeang, Peduli Mamuju Mar 30",Infrastruktur & Jalan,Belum Dilabeli,Belum Dilabeli,Tidak diketahui
twitter,2026-03-26,@PasangMata,"Ada jalan berlubang yang cukup dalam di Jalan Raya Hankam Bekasi arah Pondok Gede. Mohon pihak terkait untuk memperbaiki. Selain sudah lama berlubang, sangat berbahaya bagi pengendara roda dua Mar 30",Infrastruktur & Jalan,Belum Dilabeli,Belum Dilabeli,Tidak diketahui
twitter,2026-03-26,@gingerbos123,"80 tahun merdeka, tapi masih ada warga yang harus lahiran di hutan gara-gara jalan rusak . Ironisnya, daerah sebelahnya justru penghasil aspal kelas dunia. Kok bisa ya, aspalnya ada tapi jalannya tetep amburadul… Kesejahteraan masyarakat Kopeang Mar 30",Infrastruktur & Jalan,Belum Dilabeli,Belum Dilabeli,Tidak diketahui
twitter,2026-03-26,@Pugalu15,Kondisi jalan rusak memaksa seorang ibu melahirkan di hutan. Hal ini bukti nyata bahwa kesejahteraan masyarakat Kopeang masih terabaikan oleh pemerintah daerah. Mar 30,Infrastruktur & Jalan,Belum Dilabeli,Belum Dilabeli,Tidak diketahui
twitter,2026-03-26,@AdzkiyaIna,"80 thn merdeka, tapi masih ada warga yang harus lahiran di hutan gara-gara 2.5K jalan rusak . Ironisnya, daerah sebelahnya justru penghasil aspal kelas dunia. Kok bisa ya, aspalnya ada tapi jalannya tetep amburadul Kesejahteraan masyarakat Kopeang Peduli Mamuju | Clara Shinta | Senin Mar 30",Infrastruktur & Jalan,Belum Dilabeli,Belum Dilabeli,Tidak diketahui
twitter,2026-03-26,@pln_sulselrabar,"Sedih banget, udah 80 tahun merdeka tapi masih ada warga yang harus lahiran di hutan gara-gara jalan rusak . Ironisnya, daerah deket situ justru penghasil aspal kelas dunia. Kok bisa gitu ya… Kesejahteraan masyarakat Kopeang, Peduli Mamuju Mar 30",Infrastruktur & Jalan,Belum Dilabeli,Belum Dilabeli,Tidak diketahui
twitter,2026-03-26,@BurhanMuhtadi,"saya pernah tugas ke daerah yg aksesnya sulit (naik turun bukit, jalan rusak , sempit dan susah kalo papasan). iseng tanya ke org puskesmas, ""disini udah ada MBG pak?"" dijawab ""belum ada, beberapa kemarin udah survei tapi belum lanjut"". Kenapa? simpel, mitra nyarinya profit. Mar 30",Infrastruktur & Jalan,Belum Dilabeli,Belum Dilabeli,Tidak diketahui
twitter,2026-03-26,@AnakLolina2,"Betapa bangsat nya, cobalah dana MBG d bagi bagi ke ke daerah2 yg jln nya hancur begini, gk ada lg rakyat yg beranak d jalan rusak Mar 30",Infrastruktur & Jalan,Belum Dilabeli,Belum Dilabeli,Tidak diketahui
twitter,2026-03-26,@VioletIm66993,"Ambil contoh bali, yg menyumbang pajak lumayan besar untuk indonesia. Yg didapat apa? Jalan rusak ga ada perbaikan. Sampah ga ada pengelolaan yg jelas. Pemerintah bali ngapain? Mabok arak dan uang. Sibuk nyari investor beli tanah untuk pembangunan villa/hotel. Mar 30",Infrastruktur & Jalan,Belum Dilabeli,Belum Dilabeli,Tidak diketahui
