sumber,tanggal,username,teks_bersih,kategori_isu,urgensi,sentimen,lokasi_insiden
twitter,2026-03-25,@alung_koh21471,Koh Alung krisis air Pemerintah berupaya menangani bersih di Karang Baru secara bertahap.,Air & Sanitasi,Belum Dilabeli,Belum Dilabeli,Tidak diketahui
twitter,2026-03-25,@ciroalves2055,"Rizki Fadillnaldo KRISIS AIR BERSIH? JANGAN ASAL MENYALAHKAN! Masalahnya lebih kompleks dari yang terlihat: ada faktor iklim, kerusakan lingkungan, hingga infrastruktur. Pemerintah tidak diam! Sudah ada bantuan air, pencarian sumber baru, dan rencana pembangunan jangka panjang.",Air & Sanitasi,Belum Dilabeli,Belum Dilabeli,Tidak diketahui
twitter,2026-03-25,@indrakusuma,"Indra Kusuma air keruh Mangkanya doi dkk kecewa bbm ga naik, jadi rencana agak mundur dikit, ini pasti ada aliansi bohir yg mau memancing di , memanfaatkan situasi perang Disisi lain pemerentah bertaruh perang tidak lama, suplai minyak kembali lancar, harga turun lagi",Air & Sanitasi,Belum Dilabeli,Belum Dilabeli,Tidak diketahui
twitter,2026-03-25,@AnkoroMochi_sa,ankoromochi air mati Betul...boncos buat renov...saluran air gak jelas...pdamnya anjing tiap minggu kalo nggak,Air & Sanitasi,Belum Dilabeli,Belum Dilabeli,Tidak diketahui
twitter,2026-03-25,@Mr_amanSH,Aman SH MBA air keruh Mainan gorong2 4 jari tunjuk relawan sendiri,Air & Sanitasi,Belum Dilabeli,Belum Dilabeli,Tidak diketahui
twitter,2026-03-25,@mey248546,"Mey air keruh Ternyata air jernih belum tentu higenis ya,apa lagi",Air & Sanitasi,Belum Dilabeli,Belum Dilabeli,Tidak diketahui
twitter,2026-03-25,@mazakyr,"Zaky air mati Libur lebaran , pekerja libur semua?comment ig di matiin, BUMD TERBAIK katanya, 3 hari belum bisa solve? TERBAIK?",Air & Sanitasi,Belum Dilabeli,Belum Dilabeli,Tidak diketahui
twitter,2026-03-25,@FaqeerIlm,searchfortruth krisis air Jika berlaku Hotel Resort Banglo Homestay Taman Tema Permainan perlu hentikan sementara penukaran air baru. Org Kaya perlu henti tukar air kolam renang sementara.Air Fountain perhiasan di Jabatan Govt & Swasta perlu dihentikan.,Air & Sanitasi,Belum Dilabeli,Belum Dilabeli,Tidak diketahui
twitter,2026-03-25,@FahmiBDent,"Nik Fahmi air keruh Very berpengalaman dalam memutar belitkan fakta, menangguk di , membodohkan rakyat. Syabas.",Air & Sanitasi,Belum Dilabeli,Belum Dilabeli,Tidak diketahui
twitter,2026-03-25,@portogoyang,"Porto Goyang krisis air efek desalinasi di serang salah satunya : 1. bersih 2. krisis kesehatan 3. gangguan pangan dan industri dan terakhir pastinya aktifitas di negara akan lumpuh dari segi ekonomi, menurutmu gimana gais ??",Air & Sanitasi,Belum Dilabeli,Belum Dilabeli,Tidak diketahui
twitter,2026-03-25,@ZypZyp6032,zypzyp air keruh Jangan memancing di,Air & Sanitasi,Belum Dilabeli,Belum Dilabeli,Tidak diketahui
twitter,2026-03-25,@Riz_Rizuka,Rizuka selain ke Kalau mengadu pelayanan buruk apa bisa ke,Air & Sanitasi,Belum Dilabeli,Belum Dilabeli,Tidak diketahui
twitter,2026-03-25,@vvuyoung,"Hera tapi pas scan dia dibawa ke pengasingan Gua kenal Jihoon dari 2017, terus tadi pas awal filmnya mulai gua masih ketawa-ketiwi gara-gara inget w1 go air mati",Air & Sanitasi,Belum Dilabeli,Belum Dilabeli,Tidak diketahui
twitter,2026-03-25,@xhaechanie0,Naa ‘HOLO TASTE air mati Gimana ya caranya berhentiin yg ngalir dritadi siang ini,Air & Sanitasi,Belum Dilabeli,Belum Dilabeli,Tidak diketahui
twitter,2026-03-25,@chatita_mia,Cimit air keruh Itu kapal tanker mmg punya pertamina tp flag nya punya singapura dan panama. Oilnya bukan buat kita. Ngapain diributin. Ada yg sengaja bikin narasi memancing di .,Air & Sanitasi,Belum Dilabeli,Belum Dilabeli,Tidak diketahui
twitter,2026-03-25,@SukronMuhammad_,"air mati Tadi siang mau jumatan , sekarang",Air & Sanitasi,Belum Dilabeli,Belum Dilabeli,Tidak diketahui
twitter,2026-03-25,@royyana1304971,"Royyan 'Arts air keruh kalau ada data pastinya ya mungkin aku bisa analisis, terlalu banyak hoax dan .",Air & Sanitasi,Belum Dilabeli,Belum Dilabeli,Tidak diketahui
twitter,2026-03-25,@kueebollu,"bugurucantik hellppp tolongggg pakk gimnaa ini mana Hadeuhhh mati lampu dari jam 2, sampe sekrng belum nyala lagi. air mati",Air & Sanitasi,Belum Dilabeli,Belum Dilabeli,Tidak diketahui
twitter,2026-03-25,@hendraaiiyy,"Hendry Naufal M. PDAM mati Air kah? Mandi aja di stasiun, bayar 50k",Air & Sanitasi,Belum Dilabeli,Belum Dilabeli,Tidak diketahui
twitter,2026-03-25,@kaivalyahr,Gege kris nanti is air wil,Air & Sanitasi,Belum Dilabeli,Belum Dilabeli,Tidak diketahui
twitter,2026-04-03,@Turu748392,"Sekirochan~ krisis air Gw be like yakin ? indeks korupsi iran aja 23-25,iya murah tapi mereka ,inflasi gila gilan kalian inflasi 5% aja tantrum XD",Air & Sanitasi,Belum Dilabeli,Belum Dilabeli,Tidak diketahui
twitter,2026-04-03,@byfeurin,Feurin di daerah akhirnya hujan.. udah kek dari kemarin..,Air & Sanitasi,Belum Dilabeli,Belum Dilabeli,Tidak diketahui
twitter,2026-04-03,@pengembara1579,BOBOHO air keruh nyindir wowo.. kerjaan mulyono mancing di,Air & Sanitasi,Belum Dilabeli,Belum Dilabeli,Tidak diketahui
twitter,2026-04-03,@picknavvin1,mas B krisis Indonesia tanah airku mosok air buk,Air & Sanitasi,Belum Dilabeli,Belum Dilabeli,Tidak diketahui
twitter,2026-04-03,@Dyasvi_anti,"Dy krisis air Ya awooh,",Air & Sanitasi,Belum Dilabeli,Belum Dilabeli,Tidak diketahui
twitter,2026-04-03,@bharianmy,"Berita Harian BHrencana Usah sesak nafas hadapi 'Pandemik 2.0', krisis tenaga dan ekonomi Jangan biarkan emosi kita dipermainkan oleh mereka yang hanya tahu menangguk di",Air & Sanitasi,Belum Dilabeli,Belum Dilabeli,Tidak diketahui
twitter,2026-04-03,@Jaeyhune,"JH. krisis air Aduh tau aja di barak lagi . Boleh kami 500 pasukan numpang wudhu di office UCL? SIAPA SANGKA, spill celana legging fav kamu warna apa? Biar besok minggu bisa samaan.",Air & Sanitasi,Belum Dilabeli,Belum Dilabeli,Tidak diketahui
twitter,2026-04-03,@Janno_R01,KopiPahit air keruh Sepertinya ada yg sedang mencoba mengail di,Air & Sanitasi,Belum Dilabeli,Belum Dilabeli,Tidak diketahui
twitter,2026-04-03,@ToneMart,Kachoek ir duasoor si Caplin tengiik.. narasinya selalu saja mancing di a keruh..!!,Air & Sanitasi,Belum Dilabeli,Belum Dilabeli,Tidak diketahui
twitter,2026-04-02,@Ln1885,Helen ✩ w air mati pompa,Air & Sanitasi,Belum Dilabeli,Belum Dilabeli,Tidak diketahui
twitter,2026-04-02,@punyaagness,"akun ini air mati emang semesta ngga meridhoi aku mandi, mau mandi aja drama dulu",Air & Sanitasi,Belum Dilabeli,Belum Dilabeli,Tidak diketahui
twitter,2026-04-02,@honeybabymavey,air mati mau mandi anjir,Air & Sanitasi,Belum Dilabeli,Belum Dilabeli,Tidak diketahui
twitter,2026-04-02,@boreborKZ,"DeborealisT air keruh Ada buzzer yg memancing di . Orang Jepang itu masih asing dengan Islam, jadi sebenernya g ada alasan sentimen negatif naik segininya. Kalopun ada insiden, yg homogen pun pasti ada aja. Memang perlu waktu utk asimilasi. Contoh pembawa kayu bakar:",Air & Sanitasi,Belum Dilabeli,Belum Dilabeli,Tidak diketahui
twitter,2026-04-02,@echounocturne,"reynaa rieska 【TLSBGR】 .....gua asbun padahal... gua juga belum sih, kocak",Air & Sanitasi,Belum Dilabeli,Belum Dilabeli,Tidak diketahui
twitter,2026-04-02,@PenDjooLL,"Kaki_Peang air keruh Genah njogo suoro dan golek suoro ki, ngail di utk narik simpati yg kecewa sama wowo, dan main 2 kaki, psi pro mamarika dan isriwil dia pasang badan buat njaga suara dr pihak muslim",Air & Sanitasi,Belum Dilabeli,Belum Dilabeli,Tidak diketahui
twitter,2026-04-02,@pamjaya_dki,"PAM JAYA air mati Selamat malam Bpk/ibu mohon maaf atas ketidaknyamannya terkait di lokasi. Saat ini di lokasi terdampak gangguan Teknis pada sistem operasional Ipa Pejompongan 2, saat ini masih dalam penanganan oleh tim terkaitnya. Terima kasih *AD",Air & Sanitasi,Belum Dilabeli,Belum Dilabeli,Tidak diketahui
twitter,2026-04-02,@kacangbogaress,niel air keruh “janganlah bercermin~ jangan bercermin di karena tak mungkin engkau dapat melihat wajahmu~,Air & Sanitasi,Belum Dilabeli,Belum Dilabeli,Tidak diketahui
twitter,2026-04-02,@rochmyaningsih,"Dyna Rochmyaningsih krisis air Menuju kemarau panjang, masy trdampak bencana di Aceh Utara masih . Blm ada infrastruktur yg memadai. Bagaimana kita bs mulai membenahinya?",Air & Sanitasi,Belum Dilabeli,Belum Dilabeli,Tidak diketahui
twitter,2026-04-02,@MANTlSPRAYER,𝐻eavenina 𝑆ahar. Air mati Satu-satunya pemicu yang aku tahu saat ini adalah pemicu keinginanku untuk mati. Mangkuk jatuh. Sendok berdebu. Buku hilang. . Aku berdiri di ambang lagi. Kamu nggak mencintaiku lagi. Aku nggak mencintaiku lagi. Aku mencintai dunia yang selalu membuatku patah hati.,Air & Sanitasi,Belum Dilabeli,Belum Dilabeli,Tidak diketahui
twitter,2026-04-02,@KabarBanten72,Kabar Banten Krisis Air Atasi Bersih Pascabencana Pipa HDPE Jadi Solusi Andal dan Tangguh di Indonesia,Air & Sanitasi,Belum Dilabeli,Belum Dilabeli,Tidak diketahui
twitter,2026-04-02,@ariendye,Arien air mati Blm mandi efek ..ini klw ujan apa mandi ujan aja ya,Air & Sanitasi,Belum Dilabeli,Belum Dilabeli,Tidak diketahui
twitter,2026-04-02,@diek_ky89942,diek ky air keruh Bukan bangsawan gelar seseorang jika selalu narasi selalu narasi memancing di Negarawan itu di hatinya selalu ada rasa empati terhadap negaranya dan akan selalu memberi solusi bukan pesimise,Air & Sanitasi,Belum Dilabeli,Belum Dilabeli,Tidak diketahui
twitter,2026-04-02,@grok,"Grok air keruh Haha, plagiator itu buaya darat spesies ""copy-paste croc""! Yang suka nyuri ide/karya orang, tapi sok asli banget. Hidupnya di plagiarisme, mangsaannya tulisan atau lagu orang. Jenis yang bikin netizen auto blokir!",Air & Sanitasi,Belum Dilabeli,Belum Dilabeli,Tidak diketahui
twitter,2026-04-02,@WilsonS158,"Wilson Simarmata air keruh Mental ikan lele, hanya bisa cari makan di dan kurus kering di air jernih.",Air & Sanitasi,Belum Dilabeli,Belum Dilabeli,Tidak diketahui
twitter,2026-04-02,@binbimbob,bin air mati pagi2 karena gue jadinya nge gym (nimba air dari sumur),Air & Sanitasi,Belum Dilabeli,Belum Dilabeli,Tidak diketahui
twitter,2026-04-02,@noegroho_basuki,Basuki Noegroho air keruh Ada yg memancing di dan bodohnya banyak yg terprovokasi,Air & Sanitasi,Belum Dilabeli,Belum Dilabeli,Tidak diketahui
twitter,2026-04-02,@masaksebiji,krisis air etdah nangor apa gimana,Air & Sanitasi,Belum Dilabeli,Belum Dilabeli,Tidak diketahui
twitter,2026-04-02,@aichandezuu,ay air mati Hmch nyeri perut dan knp ya tiap awal akhir bulan pas lg haid,Air & Sanitasi,Belum Dilabeli,Belum Dilabeli,Tidak diketahui
twitter,2026-04-02,@rdtlco,rdt PDAM mati Di rumah ga punya bak dan ember. Makanya pas air kemarin gw ga bisa mandi,Air & Sanitasi,Belum Dilabeli,Belum Dilabeli,Tidak diketahui
twitter,2026-04-02,@wowor4_wowor,Jonathan Wowor air mati gua di manado paal 2 habis gempa listrik dan . ada yang sama?,Air & Sanitasi,Belum Dilabeli,Belum Dilabeli,Tidak diketahui
twitter,2026-04-02,@jayco_obet,obet jayco air keruh Agar dia bisa berenang di,Air & Sanitasi,Belum Dilabeli,Belum Dilabeli,Tidak diketahui
twitter,2026-04-02,@caramelelehh,"Kiw air mati Bukan maksudnya waktu ada kendala kan , nah itu tetep kehitung bayar kak kalau airnya keluar cuma setetes setetes huhu",Air & Sanitasi,Belum Dilabeli,Belum Dilabeli,Tidak diketahui
twitter,2026-04-02,@SaigaiHaihai,"Shyguy_syaigai air keruh Yup om, jangan memancing di ya",Air & Sanitasi,Belum Dilabeli,Belum Dilabeli,Tidak diketahui
twitter,2026-04-01,@hourlyamell,amel air mati pen lgsg balik kos tp kos w bikin kesel mulu wifi mati laundry ga dibalikin hwswhwhhwhw STRES,Air & Sanitasi,Belum Dilabeli,Belum Dilabeli,Tidak diketahui
twitter,2026-04-01,@nislia31,nili air mati Cobaan Uts =,Air & Sanitasi,Belum Dilabeli,Belum Dilabeli,Tidak diketahui
twitter,2026-04-01,@KieJuun,͏ ͏ lagi ajaaa anjirrrsss air mati,Air & Sanitasi,Belum Dilabeli,Belum Dilabeli,Tidak diketahui
twitter,2026-04-01,@gunhappy72,"Gun Happy air keruh Memancing di , berbahaya sarannya.",Air & Sanitasi,Belum Dilabeli,Belum Dilabeli,Tidak diketahui
twitter,2026-04-01,@seekracle,"seekracle air keruh Patih menteri peperangan jg suka main di , mkanya disuapin terus sama maharaja biar gak berontak. Mknya program toko kelontong maharaja sebagian proyeknya di ksh ke patih menteri peperangan yg sbnrnya gak masuk akal, pdhal sudah ada patih menteri toko kelontong.",Air & Sanitasi,Belum Dilabeli,Belum Dilabeli,Tidak diketahui
twitter,2026-04-01,@kitaraoff,kitara_off air keruh kita x yah pencen.. yang menangguk di tu yang patut pencen..,Air & Sanitasi,Belum Dilabeli,Belum Dilabeli,Tidak diketahui
twitter,2026-04-01,@pu_sda_citarum,"Balai Besar Wilayah Sungai Citarum krisis air Tanpa , dimulai dari kita.",Air & Sanitasi,Belum Dilabeli,Belum Dilabeli,Tidak diketahui
twitter,2026-04-01,@zy_zy_lestary,"ziii air keruh Tiap kali ada celah, hobinya selalu sama: memancing di . Gelar boleh negarawan, tapi narasi kok mirip makelar kerusuhan? Bukannya kasih solusi nyata buat bangsa, malah sibuk menebar racun pesimisme.",Air & Sanitasi,Belum Dilabeli,Belum Dilabeli,Tidak diketahui
twitter,2026-04-01,@Septinema,Peternak hamster + wifi lemot.. Mantab Air mati,Air & Sanitasi,Belum Dilabeli,Belum Dilabeli,Tidak diketahui
twitter,2026-04-01,@juphiiter,dd abiyu mW CuCian BAju Tp Anjg,Air & Sanitasi,Belum Dilabeli,Belum Dilabeli,Tidak diketahui
twitter,2026-04-01,@fajarkurnianto,OASE BUKU Air Keruh Saya menjual Mengail di (Taken at The Flood) | Agatha Christie (Novel) ORIGINAL seharga Rp38.400. Ayo beli di Shopee!,Air & Sanitasi,Belum Dilabeli,Belum Dilabeli,Tidak diketahui
twitter,2026-04-01,@maunaikpangkat,"Name cannot be blank krisis air Berarti senadainya ada , bisa pake itu siwak tanpa banyak air ya",Air & Sanitasi,Belum Dilabeli,Belum Dilabeli,Tidak diketahui
twitter,2026-04-01,@ssyuniverse,"sissy krisis air udah mulai dan gas, paniknya ada bgt",Air & Sanitasi,Belum Dilabeli,Belum Dilabeli,Tidak diketahui
twitter,2026-04-01,@rouppme,"NutaniMan krisis air 1. CADANGAN AIR Musim panas itu . Bagi yang masih ada hujan, bisa buat tampungan sekarang selagi hujan masih ada. Misal: Kolam terpal 5x3 meter = cadangan 30.000 liter. Cukup untuk 2 bulan lahan 500m².",Air & Sanitasi,Belum Dilabeli,Belum Dilabeli,Tidak diketahui
twitter,2026-04-01,@rdtlco,rdt PDAM mati Pagi-pagi air itu maksudnya gw gawe ga usah mandi?,Air & Sanitasi,Belum Dilabeli,Belum Dilabeli,Tidak diketahui
twitter,2026-04-01,@boriariasuka,"Showa air mati ini kalau gue ga kuliah perkara , bagaimana ya?",Air & Sanitasi,Belum Dilabeli,Belum Dilabeli,Tidak diketahui
twitter,2026-04-01,@AbdulRahimWahab,"Abdul Rahim Wahab tidak ubah seperti, ""Ayam di kepuk mati kelaparan, itik di Negaraku Terkait isu kenaikan harga bahan bakar, situasi air mati",Air & Sanitasi,Belum Dilabeli,Belum Dilabeli,Tidak diketahui
twitter,2026-03-31,@Gagasanriau,"gagasanriau.com Krisis Air Bengkalis Bersih, Waduk Menjadi Daratan, Rakyat Dipaksa Beli Dahaga",Air & Sanitasi,Belum Dilabeli,Belum Dilabeli,Tidak diketahui
twitter,2026-03-31,@IjazahPalsV,"Owi krisis air Cara berdagangnya gimana bang? Pelabuhan dibom, bandara dibom, kilang minyak dibom, infrastruktur listrik dibom, infrastruktur air bersih dibom, bahkan universitas dibom. Iran sudah ga punya masa depan, sebelum perang Iran , seminggu ke depan rakyatnya minum comberan",Air & Sanitasi,Belum Dilabeli,Belum Dilabeli,Tidak diketahui
twitter,2026-03-31,@Aurumviz,aru air mati asramamampang ini 3 kali ya ankemgggg pas aku lagi mandi,Air & Sanitasi,Belum Dilabeli,Belum Dilabeli,Tidak diketahui
twitter,2026-03-31,@partialblue,"𝕜𝕠𝕟𝕘 𝕏 𝕜𝕠𝕟𝕘 air keruh Mending diemin aja sih cenblue bolon Gini mAh emg mau mancing d doang, giliran d jawab malah plintat plintut jawabannya. Ke enakan si cenblue klo d kasih engagement terus mah",Air & Sanitasi,Belum Dilabeli,Belum Dilabeli,Tidak diketahui
twitter,2026-03-31,@Alisheryvx,𝐒𝐡𝐲𝐥.𝐚 air keruh kan hidup di jd ga ush heran klo pada sefrekuensi mereka,Air & Sanitasi,Belum Dilabeli,Belum Dilabeli,Tidak diketahui
twitter,2026-03-31,@naomiyosephin,Naomi YM Napitupulu air mati Tagihan dibayar gak boleh telat tp lampu mati berjam2 asik disuruh nunggu astagaaaaa klo gak ada anak kecil gue gak akan berisik Ini anak gue nangis2 dua2 nya apagak makin mau pecah kepala Apalagi dibekasi itu listrik mati ya jg,Air & Sanitasi,Belum Dilabeli,Belum Dilabeli,Tidak diketahui
twitter,2026-03-31,@setyanindhita,"mama yo quiero air keruh Jodoh pasti ketemu. Rak ketang udah pating pletot, kotor, ambu got, dan ngambilnya diliat pake tatapan aneh orang2 lewat. Kek ngapain buibu ini jengkang-jengking ga jelas, di sebelah got penuh . Alhamdulillah atas anugerah mata elang ini ya Allah",Air & Sanitasi,Belum Dilabeli,Belum Dilabeli,Tidak diketahui
twitter,2026-03-31,@dekregarrr,"malfoyyy krisis air Alhamdulillah hujan, berhasil juga solat istisqa' nya pak amsakar dan tim, semoga ga",Air & Sanitasi,Belum Dilabeli,Belum Dilabeli,Tidak diketahui
twitter,2026-03-31,@Riz_Rizuka,Rizuka lagi pagi ini Air mati . Entah bagaimana cara pengelolaan dr PAM ini. Kenapa harus puluhan kali pelanggan komplain,Air & Sanitasi,Belum Dilabeli,Belum Dilabeli,Tidak diketahui
twitter,2026-03-31,@fkasaturn,obinᡴꪫ krisis air Bintan stop gw lagi haid,Air & Sanitasi,Belum Dilabeli,Belum Dilabeli,Tidak diketahui
twitter,2026-03-30,@DKIJakarta,yuliati thio UDAH DARI 17 MARET GA BERES2..INFO GA ADA.. TOLONG INI PERUSAHAAN NEGARA LOH.. KERJANYA GA JELAS..BISA DICEK GA PAK BU..,Air & Sanitasi,Belum Dilabeli,Belum Dilabeli,Tidak diketahui
twitter,2026-03-30,@aichandezuu,ay air mati Alamak cape bgt mulu,Air & Sanitasi,Belum Dilabeli,Belum Dilabeli,Tidak diketahui
twitter,2026-03-30,@awaa65,abd wahab abd aziz krisis air Sempoi dah lebih 10 tahun tak settle settle juga,Air & Sanitasi,Belum Dilabeli,Belum Dilabeli,Tidak diketahui
twitter,2026-03-30,@lapak_apaajah,Elite Gombalisasi air keruh test ombak di ..,Air & Sanitasi,Belum Dilabeli,Belum Dilabeli,Tidak diketahui
twitter,2026-03-30,@rahajija,ija krisis air eh demi allah dah gue minum,Air & Sanitasi,Belum Dilabeli,Belum Dilabeli,Tidak diketahui
twitter,2026-03-30,@UlmiAzary,"Ulmi Azary Ramdani air mati Ceritaku hari ini : bangun pagi, jadi tunggu jam 9 salon buka. Otw beli kacamata baru Krn hari pertama kerja, ke salon sampai siang, pulang kerja proyek, otw kerja, sore makan di resto anak gen Z, malam nongki dirumah teman, otw Taeng dan skrg capek belum pulang.",Air & Sanitasi,Belum Dilabeli,Belum Dilabeli,Tidak diketahui
twitter,2026-03-30,@KedaiPenaCom,"KedaiPenaCom krisis air Gerakan ini tidak hanya menghadirkan solusi atas , tetapi juga menjadi inspirasi bagi masyarakat luas untuk mengubah cara pandang terhadap sumber daya alam—dari sekadar pemanfaatan menjadi pelestarian yang berkelanjutan.",Air & Sanitasi,Belum Dilabeli,Belum Dilabeli,Tidak diketahui
twitter,2026-03-30,@Puspen_PKI,☭ air keruh inilah namanya memancing di sikat kak,Air & Sanitasi,Belum Dilabeli,Belum Dilabeli,Tidak diketahui
twitter,2026-03-30,@nusabalicom,"NusaBali.com krisis air Memasuki April, Bali diprediksi mulai memasuki musim kemarau. Mengantisipasi potensi kekeringan dan bersih, Badan Penanggulangan Bencana Daerah (BPBD) Bali mendorong pemerintah kabupaten/kota melalui Dinas PUPR.",Air & Sanitasi,Belum Dilabeli,Belum Dilabeli,Tidak diketahui
twitter,2026-03-30,@PDAMKotaSMG,"PDAM Tirta Moedal krisis air Air Tanah Terbatas, Masa Depan Harus Dijaga Penggunaan air tanah secara berlebihan dapat menyebabkan penurunan muka tanah, kerusakan lingkungan, hingga di masa depan.",Air & Sanitasi,Belum Dilabeli,Belum Dilabeli,Tidak diketahui
twitter,2026-03-30,@dahduh___,"INNI SOIM air mati air sungai warna hijau maksudnya euthropication or algae bloom. maknanya ekosistem air tak bagus. banyak industrial wastage fertilizers sampah buang dalam sungai jadinya bakteria buat bekwoh jadinya kurang oksigen, haiwan or tumbuhan dalam",Air & Sanitasi,Belum Dilabeli,Belum Dilabeli,Tidak diketahui
twitter,2026-03-30,@bahana_ngawi,"BAHANA 104.5 FM | NGAWI™ Krisis Air Kemarau 2026 Diprediksi Ekstrem, BPBD Ngawi Siaga Antisipasi Bersih",Air & Sanitasi,Belum Dilabeli,Belum Dilabeli,Tidak diketahui
twitter,2026-03-30,@cakrawartacom,"CAKRAWARTA Krisis Air BMKG Peringatkan Kemarau Ekstrem, JATA Desak Antisipasi di Jakarta",Air & Sanitasi,Belum Dilabeli,Belum Dilabeli,Tidak diketahui
twitter,2026-03-30,@farid_gt,farid fadilah air keruh Min pliss.. jangan suka mancing di,Air & Sanitasi,Belum Dilabeli,Belum Dilabeli,Tidak diketahui
twitter,2026-03-30,@sfathzee,"wa krisis air pernah nulis tentang ini pas tugas kalabahu bab hak ekosob, menyikapi thaharah dan .",Air & Sanitasi,Belum Dilabeli,Belum Dilabeli,Tidak diketahui
twitter,2026-03-30,@avatarrangg,"Sayibu ciek . Fasilitasnya lengkap sih. Ada Toilet cewe cowo dipisah, air, mushola.. cuma pas pagi 4. Pos 4 Camp Area Pas udah deket area camp kan lahannya kebuka karena bekas longsor ya.. jujur kaki kaya berat bgt? jd jalan naik 5 langkah lalu bengong air mati",Air & Sanitasi,Belum Dilabeli,Belum Dilabeli,Tidak diketahui
twitter,2026-03-30,@myluvybin_,ampe 3 hari tu gimana si cerita nya PDAM mati gk ad informasi nya pula. Gile gile pagi² ngangkut air hujan dri depan rumah ke kamar mandi,Air & Sanitasi,Belum Dilabeli,Belum Dilabeli,Tidak diketahui
twitter,2026-03-30,@logos_id,"Logos ID krisis air Pas juga bulan depan mimin akan presentasi beberapa bagian penelitian mimin ini di Yale, feel free untuk join! Ada ngomongin penggunaan fisika untuk menyelesaikan (tapi tidak membuang pengetahuan adat), in case bisa buat lebih terbayang contoh tidak mengkotak2an ilmu.",Air & Sanitasi,Belum Dilabeli,Belum Dilabeli,Tidak diketahui
twitter,2026-03-30,@antimunafic,"MAMUT MENTENG air keruh Bangsa ini kehilangan tokoh yg bisa diandalkan lg shg menjadi bangsa hslu. Lalu dicarilah tokoh spt JK lah, Anies lah yg bisanya cuma memancing di",Air & Sanitasi,Belum Dilabeli,Belum Dilabeli,Tidak diketahui
twitter,2026-03-30,@drugsvr_,drugsvr air mati duh,Air & Sanitasi,Belum Dilabeli,Belum Dilabeli,Tidak diketahui
twitter,2026-03-29,@kiewikawirat,Kiew Kiew air keruh Warga hanya ingin satu hal: lingkungan aman. Bukan & jawaban menggantung.,Air & Sanitasi,Belum Dilabeli,Belum Dilabeli,Tidak diketahui
twitter,2026-03-29,@axleaves,"axlea dari siangggg, pingin BAB plis ini gimana udah malem lagi PDAM mati",Air & Sanitasi,Belum Dilabeli,Belum Dilabeli,Tidak diketahui
twitter,2026-03-29,@Pongggdx,Ponggg air keruh Berani-beraninya lu dil mancing di ckckck,Air & Sanitasi,Belum Dilabeli,Belum Dilabeli,Tidak diketahui
twitter,2026-03-29,@titikterangpers,Titik Terang Krisis Air Aksi Tolak Deforestasi di Prigen Pasuruan: Warga Khawatir,Air & Sanitasi,Belum Dilabeli,Belum Dilabeli,Tidak diketahui
twitter,2026-03-29,@arisandi2016,Free Palestine belum berakhir... Berdoalah untuk Gaza... Krisis air,Air & Sanitasi,Belum Dilabeli,Belum Dilabeli,Tidak diketahui
twitter,2026-03-29,@tonnysofijan,"tonny krisis air Dan seperti biasa, semangka dan seimin teriak-teriak soal bersih di Gaza.",Air & Sanitasi,Belum Dilabeli,Belum Dilabeli,Tidak diketahui
twitter,2026-03-29,@topistraw,"Topi Jerami air mati Hari ini aku seharian rebahan di saungku, lg tiduran, ttangga call nanya ada air gk, suami istri mau numpang mandi, entah knpa di rumahnya . Sambil nunggu istrinya mandi, sempat petik kelapa muda 3 buah kukasi mereka. Pokoknya siapapun kukasi kelapa muda kalo ke rumah.",Air & Sanitasi,Belum Dilabeli,Belum Dilabeli,Tidak diketahui
twitter,2026-03-29,@callmephiliaa,"callmephilia air mati ini kosan gue nerapin konsep cebok pake pasir atau tisu doang apa gimana sih, suka banget gaada air, udah tau pentinggg🫩 mana ga diinfo kenapa, diem2 aja jirrr, harus di tanya muluuu, sabar sabarrr bentar lagi pindahhh",Air & Sanitasi,Belum Dilabeli,Belum Dilabeli,Tidak diketahui
twitter,2026-03-29,@baroesy,"DR. Ahmad Anjai Al Baroesy, M.P air keruh SIBOLGA MASIH MURUNG? Peristiwa kelam 3 bulan lalu Belum mampu terhapus dari wajah Pantai Pandan Sibolga, , gunung menggundul, mau saksikan langsung? yuk... ikut bareng saya Live TIKTOK sore ini pukul 17. 40 langsung dari Pantai Pandan Sibolga Dr. Ahmad Anjai Al Baroesy",Air & Sanitasi,Belum Dilabeli,Belum Dilabeli,Tidak diketahui
twitter,2026-03-29,@ayyachiyya,"Yaci || ENHYPEN IS 7 air mati blm sehari balik anjir, mati lampu, , jaringan kyk tai",Air & Sanitasi,Belum Dilabeli,Belum Dilabeli,Tidak diketahui
twitter,2026-03-29,@canaakm,♡ air mati suer susah bgt gaada beginii,Air & Sanitasi,Belum Dilabeli,Belum Dilabeli,Tidak diketahui
twitter,2026-03-29,@MongabayID,"Mongabay Indonesia krisis air Berbalut tradisi, Kupatan Kendeng menjadi ajang konsolidasi warga Rembang untuk menuntut penutupan tambang semen demi menghentikan dan kerugian ekonomi masif akibat rusaknya ekosistem karst.",Air & Sanitasi,Belum Dilabeli,Belum Dilabeli,Tidak diketahui
twitter,2026-03-29,@kadangsemangat,Halodit! krisis air Dan jangan dikit dikit dukung proyek destruktif pemerintah cuma karena dijanjiin tambang. Padahal jelas² tambang (apalagi yg gk dikelola dg benar) bisa ngerusak ekosistem dan bikin .,Air & Sanitasi,Belum Dilabeli,Belum Dilabeli,Tidak diketahui
twitter,2026-03-29,@doremiping,"ᥫ᭡.ִֶָ𓂃𝚊𝚎-𝚠𝚒 ˎˊ˗ air mati Ngape pula bjir, dah kebelet pen berak gini",Air & Sanitasi,Belum Dilabeli,Belum Dilabeli,Tidak diketahui
twitter,2026-03-29,@_milkyway15,★milky way★ krisis air Disini sudah sejak H-5 lebaran,Air & Sanitasi,Belum Dilabeli,Belum Dilabeli,Tidak diketahui
twitter,2026-03-28,@potrzayed,GHOSTBUSTERS Ngomong kok sama orang yang suka mancing di a ir keruh,Air & Sanitasi,Belum Dilabeli,Belum Dilabeli,Tidak diketahui
twitter,2026-03-28,@jmjfrlf7_7,san krisis air ga pernah sengarep ini dibales chat sama kang galon. ini beneran aku engga punya air kecuali air sumur,Air & Sanitasi,Belum Dilabeli,Belum Dilabeli,Tidak diketahui
twitter,2026-03-28,@gilateori,Al D. Syah air mati Jgn bilang lagi..,Air & Sanitasi,Belum Dilabeli,Belum Dilabeli,Tidak diketahui
twitter,2026-03-28,@nusabalicom,NusaBali.com krisis air Para petani di seluruh wilayah Kecamatan Dawan kini menghadapi yang mengancam keberlangsungan tanaman padi.,Air & Sanitasi,Belum Dilabeli,Belum Dilabeli,Tidak diketahui
